title,description,department,year
6.1800 Computer Systems Engineering,"6.1800 Computer Systems Engineering()Prereq:6.1910Units: 5-1-6URL:https://mit.edu/6.1800Lecture:MW2(26-100)Lab:F1(36-144) orF2(36-144) orF1(26-142) orF2(26-142) orF1(26-210) orF2(26-210) orF1(26-314) orF2(26-314) orF1(4-149) orF2(4-149) orF1(4-261) orF2(4-261) orF1(4-145) orF2(4-145) orF1(24-307) orF2(24-307)Recitation:TR10(34-301,36-153,36-156) orTR11(34-301,36-153,36-156,34-303) orTR12(34-303,36-155) orTR1(34-302,35-310,36-155,24-307) orTR2(34-302,35-308,24-307)+finalTopics on the engineering of computer software and hardware systems: techniques for controlling complexity; strong modularity using client-server design, operating systems; performance, networks; naming; security and privacy; fault-tolerant systems, atomicity and coordination of concurrent activities, and recovery; impact of computer systems on society. Case studies of working systems and readings from the current literature provide comparisons and contrasts. Includes a single, semester-long design project. Students engage in extensive written communication exercises. Enrollment may be limited.K. LaCurtsTextbooks (Spring 2025)",EECS,2024
6.1810 Operating System Engineering,"6.1810 Operating System Engineering()Prereq:6.1910Units: 3-0-9Design and implementation of operating systems, and their use as a foundation for systems programming. Topics include virtual memory, file systems, threads, context switches, kernels, interrupts, system calls, interprocess communication, coordination, and interaction between software and hardware. A multi-processor operating system for RISC-V, xv6, is used to illustrate these topics. Individual laboratory assignments involve extending the xv6 operating system, for example to support sophisticated virtual memory features and networking.M. Kaashoek",EECS,2024
6.1820[J] Mobile and Sensor Computing,"6.1820[J] Mobile and Sensor Computing()(Same subject asMAS.453[J])Prereq:6.1800or permission of instructorUnits: 3-0-9Lecture:TR1-2.30(24-121)Focuses on ""Internet of Things"" (IoT) systems and technologies, sensing, computing, and communication. Explores fundamental design and implementation issues in the engineering of mobile and sensor computing systems. Topics include battery-free sensors, seeing through wall, robotic sensors, vital sign sensors (breathing, heartbeats, emotions), sensing in cars and autonomous vehicles, subsea IoT, sensor security, positioning technologies (including GPS and indoor WiFi), inertial sensing (accelerometers, gyroscopes, inertial measurement units, dead-reckoning), embedded and distributed system architectures, sensing with radio signals, sensing with microphones and cameras, wireless sensor networks, embedded and distributed system architectures, mobile libraries and APIs to sensors, and application case studies. Includes readings from research literature, as well as laboratory assignments and a significant term project.F. AdibNo textbook information available",EECS,2024
6.1850 Computer Systems and Society,"6.1850 Computer Systems and Society()Prereq:6.1800Units: 3-0-9Explores the impact of computer systems on individual humans, society, and the environment. Examines large- and small-scale power structures that stem from low-level technical design decisions, the consequences of those structures on society, and how they can limit or provide access to certain technologies. Students learn to assess design decisions within an ethical framework and consider the impact of their decisions on non-users. Case studies of working systems and readings from the current literature provide comparisons and contrasts. Possible topics include the implications of hierarchical designs (e.g., DNS) for scale; how layered models influence what parts of a network have the power to take certain actions; and the environmental impact of proof-of-work-based systems such as Bitcoin. Enrollment may be limited.K. Lacurts",EECS,2024
6.5810 Operating System Engineering,"6.5810 Operating System Engineering()Prereq:6.1020and (6.1800or6.1810)Units: 3-6-3Fundamental design and implementation issues in the engineering of operating systems. Lectures based on the study of a symmetric multiprocessor version of UNIX version 6 and research papers. Topics include virtual memory; file system; threads; context switches; kernels; interrupts; system calls; interprocess communication; coordination, and interaction between software and hardware. Individual laboratory assignments accumulate in the construction of a minimal operating system (for an x86-based personal computer) that implements the basic operating system abstractions and a shell. Knowledge of programming in the C language is a prerequisite.Staff",EECS,2024
6.5820 Computer Networks,"6.5820 Computer Networks()Prereq:6.1800or permission of instructorUnits: 4-0-8Topics on the engineering and analysis of network protocols and architecture, including architectural principles for designing heterogeneous networks; transport protocols; Internet routing; router design; congestion control and network resource management; wireless networks; network security; naming; overlay and peer-to-peer networks. Readings from original research papers. Semester-long project and paper.H. Balakrishnan",EECS,2024
6.5830 Database Systems,"6.5830 Database Systems()(Subject meets with6.5831)Prereq: ((6.1210or6.1220) and (6.1800or6.1810)) or permission of instructorUnits: 3-0-9Topics related to the engineering and design of database systems, including data models; database and schema design; schema normalization and integrity constraints; query processing; query optimization and cost estimation; transactions; recovery; concurrency control; isolation and consistency; distributed, parallel and heterogeneous databases; adaptive databases; trigger systems; pub-sub systems; semi structured data and XML querying. Lecture and readings from original research papers. Semester-long project and paper. Students taking graduate version complete different assignments. Enrollment may be limited.S. R. Madden",EECS,2024
6.5831 Database Systems,"6.5831 Database Systems()(Subject meets with6.5830)Prereq: ((6.1210or6.1220) and (6.1800or6.1810)) or permission of instructorUnits: 3-0-9Topics related to the engineering and design of database systems, including data models; database and schema design; schema normalization and integrity constraints; query processing; query optimization and cost estimation; transactions; recovery; concurrency control; isolation and consistency; distributed, parallel and heterogeneous databases; adaptive databases; trigger systems; pub-sub systems; semi structured data and XML querying. Lecture and readings from original research papers. Semester-long project and paper. Students taking graduate version complete different assignments. Enrollment may be limited.S. R. Madden",EECS,2024
6.5840 Distributed Computer Systems Engineering,"6.5840 Distributed Computer Systems Engineering()Prereq:6.1800,6.1810, or permission of instructorUnits: 3-0-9Lecture:TR1-2.30(54-100)+finalAbstractions and implementation techniques for engineering distributed systems: remote procedure call, threads and locking, client/server, peer-to-peer, consistency, fault tolerance, and security. Readings from current literature. Individual laboratory assignments culminate in the construction of a fault-tolerant and scalable network file system. Programming experience with C/C++ required. Enrollment limited.R. MorrisNo textbook information available",EECS,2024
6.5850 Principles of Computer Systems,"6.5850 Principles of Computer Systems()Not offered regularly; consult departmentPrereq: Permission of instructorUnits: 3-0-9Introduction to the basic principles of computer systems with emphasis on the use of rigorous techniques as an aid to understanding and building modern computing systems. Particular attention paid to concurrent and distributed systems. Topics include: specification and verification, concurrent algorithms, synchronization, naming, Networking, replication techniques (including distributed cache management), and principles and algorithms for achieving reliability.M. F. Kaashoek, B. Lampson, N. B. Zeldovich",EECS,2024
6.1903 Introduction to Low-level Programming in C and Assembly,"6.1903 Introduction to Low-level Programming in C and Assembly(); first half of termPrereq:6.100AUnits: 2-2-2Credit cannot also be received for6.1904Ends Mar 21.Lecture:M9.30-11(32-123)Lab:W9.30-12(38-530) orW12-2.30(38-530) orW2.30-5(38-530)Recitation:T9.30-11(45-230) orT11-12.30(45-230) orT1-2.30(45-230) orT2.30-4(2-190) orT9.30-11(32-144) orT11-12.30(32-141) orT1-2.30(32-155) orT2.30-4(36-155)Introduction to C and assembly language for students coming from a Python background (6.100A). Studies the C language, focusing on memory and associated topics including pointers, how different data structures are stored in memory, the stack, and the heap in order to build a strong understanding of the constraints involved in manipulating complex data structures in modern computational systems. Studies assembly language to facilitate a firm understanding of how high-level languages are translated to machine-level instructions.J. D. Steinmeyer, S. Z. Hanono WachmanNo textbook information available",EECS,2024
6.1904 Introduction to Low-level Programming in C and Assembly,"6.1904 Introduction to Low-level Programming in C and Assembly(); second half of termPrereq:6.100AUnits: 2-2-2Credit cannot also be received for6.1903Begins Mar 31.Lecture:M9.30-11(32-123)Lab:W9.30-12(38-530) orW12-2.30(38-530) orW2.30-5(38-530)Recitation:T9.30-11(45-230) orT11-12.30(45-230) orT1-2.30(45-230) orT2.30-4(2-190) orT9.30-11(32-144) orT11-12.30(32-141) orT1-2.30(32-155) orT2.30-4(36-155)Introduction to C and assembly language for students coming from a Python background (6.100A). Studies the C language, focusing on memory and associated topics including pointers, how different data structures are stored in memory, the stack, and the heap in order to build a strong understanding of the constraints involved in manipulating complex data structures in modern computational systems. Studies assembly language to facilitate a firm understanding of how high-level languages are translated to machine-level instructions.J. D. Steinmeyer, S. Z. Hanono WachmanNo textbook information available",EECS,2024
6.1910 Computation Structures,"6.1910 Computation Structures(,)Prereq:Physics II (GIR),6.100A, and (Coreq:6.1903or6.1904); or permission of instructorUnits: 4-0-8Lecture:TR1(32-123)Recitation:WF10(34-302) orWF11(34-302) orWF12(34-302) orWF1(34-302) orWF2(34-302) orWF3(34-302) orWF10(35-308) orWF11(35-308) orWF12(35-308) orWF1(35-308) orWF2(8-205) orWF3(8-205)Provides an introduction to the design of digital systems and computer architecture. Emphasizes expressing all hardware designs in a high-level hardware description language and synthesizing the designs. Topics include combinational and sequential circuits, instruction set abstraction for programmable hardware, single-cycle and pipelined processor implementations, multi-level memory hierarchies, virtual memory, exceptions and I/O, and parallel systems.Fall:S. Hanono WachmanSpring:S. Hanono WachmanNo textbook information available",EECS,2024
6.1920 Constructive Computer Architecture,"6.1920 Constructive Computer Architecture()Prereq:6.1910Units: 3-8-1Illustrates a constructive (as opposed to a descriptive) approach to computer architecture. Topics include combinational and pipelined arithmetic-logic units (ALU), in-order pipelined microarchitectures, branch prediction, blocking and unblocking caches, interrupts, virtual memory support, cache coherence and multicore architectures. Labs in a modern Hardware Design Language (HDL) illustrate various aspects of microprocessor design, culminating in a term project in which students present a multicore design running on an FPGA board.Staff",EECS,2024
6.5900 Computer System Architecture,"6.5900 Computer System Architecture()Prereq:6.1910Units: 4-0-8Introduction to the principles underlying modern computer architecture. Emphasizes the relationship among technology, hardware organization, and programming systems in the evolution of computer architecture. Topics include pipelined, out-of-order, and speculative execution; caches, virtual memory and exception handling, superscalar, very long instruction word (VLIW), vector, and multithreaded processors; on-chip networks, memory models, synchronization, and cache coherence protocols for multiprocessors.J. Emer",EECS,2024
6.5910 Complex Digital Systems Design,"6.5910 Complex Digital Systems Design()Not offered regularly; consult departmentPrereq:6.1910Units: 5-5-2Introduction to the design and implementation of large-scale digital systems using hardware description languages and high-level synthesis tools in conjunction with standard commercial electronic design automation (EDA) tools. Emphasizes modular and robust designs, reusable modules, correctness by construction, architectural exploration, meeting area and timing constraints, and developing functional field-programmable gate array (FPGA) prototypes. Extensive use of CAD tools in weekly labs serve as preparation for a multi-person design project on multi-million gate FPGAs. Enrollment may be limited.Staff",EECS,2024
6.5920 Parallel Computing,"6.5920 Parallel Computing()Not offered regularly; consult departmentPrereq:6.1910or permission of instructorUnits: 3-0-9Introduction to parallel and multicore computer architecture and programming. Topics include the design and implementation of multicore processors; networking, video, continuum, particle and graph applications for multicores; communication and synchronization algorithms and mechanisms; locality in parallel computations; computational models, including shared memory, streams, message passing, and data parallel; multicore mechanisms for synchronization, cache coherence, and multithreading. Performance evaluation of multicores; compilation and runtime systems for parallel computing. Substantial project required.Staff",EECS,2024
6.5930 Hardware Architecture for Deep Learning,"6.5930 Hardware Architecture for Deep Learning()(Subject meets with6.5931)Prereq:6.1910and (6.3000or6.3900)Units: 3-3-6Lecture:MW1-2.30(54-100)Lab:TBARecitation:F11(32-155)Introduction to the design and implementation of hardware architectures for efficient processing of deep learning algorithms and tensor algebra in AI systems. Topics include basics of deep learning, optimization principles for programmable platforms, design principles of accelerator architectures, co-optimization of algorithms and hardware (including sparsity) and use of advanced technologies (including memristors and optical computing). Includes labs involving modeling and analysis of hardware architectures, architecting deep learning inference systems, and an open-ended design project. Students taking graduate version complete additional assignments.V. Sze, J. EmerNo textbook information available",EECS,2024
6.5931 Hardware Architecture for Deep Learning,"6.5931 Hardware Architecture for Deep Learning()(Subject meets with6.5930)Prereq:6.1910and (6.3000or6.3900)Units: 3-3-6Lecture:MW1-2.30(54-100)Lab:TBARecitation:F11(32-155)Introduction to the design and implementation of hardware architectures for efficient processing of deep learning algorithms and tensor algebra in AI systems. Topics include basics of deep learning, optimization principles for programmable platforms, design principles of accelerator architectures, co-optimization of algorithms and hardware (including sparsity) and use of advanced technologies (including memristors and optical computing). Includes labs involving modeling and analysis of hardware architectures, architecting deep learning inference systems, and an open-ended design project. Students taking graduate version complete additional assignments.V. Sze, J. EmerNo textbook information available",EECS,2024
6.5940 TinyML and Efficient Deep Learning Computing,"6.5940 TinyML and Efficient Deep Learning Computing()Prereq:6.1910and6.3900Units: 3-0-9Introduces efficient deep learning computing techniques that enable powerful deep learning applications on resource-constrained devices. Topics include model compression, pruning, quantization, neural architecture search, distributed training, data/model parallellism, gradient compression, on-device fine-tuning. It also introduces application-specific acceleration techniques for video recognition, point cloud, and generative AI (diffusion model, LLM). Students will get hands-on experience accelerating deep learning applications with an open-ended design project.S. Han",EECS,2024
6.5950 Secure Hardware Design,"6.5950 Secure Hardware Design()(Subject meets with6.5951)Prereq:6.1910Units: 3-0-9URL:https://shd.mit.edu/Lecture:MW1-2.30(E25-111)Introduction to basic concepts, principles, and implementation issues in the designing of secure hardware systems. Through a mixture of lectures and paper discussions, covers state-of-the-art security attacks and defenses targeting the computer architecture, digital circuits, and physics layers of computer systems. Emphasizes both the conceptual and the practical aspects of security issues in modern hardware systems. Topics include microarchitectural timing side channels, speculative execution attacks, RowHammer, Trusted Execution Environment, physical attacks, hardware support for software security, and verification of digital systems. Students taking graduate version complete additional assignments.M. YanNo textbook information available",EECS,2024
6.5951 Secure Hardware Design,"6.5951 Secure Hardware Design()(Subject meets with6.5950)Prereq:6.1910Units: 3-0-9URL:https://shd.mit.edu/Lecture:MW1-2.30(E25-111)Introduction to basic concepts, principles, and implementation issues in the designing of secure hardware systems. Through a mixture of lectures and paper discussions, covers state-of-the-art security attacks and defenses targeting the computer architecture, digital circuits, and physics layers of computer systems. Emphasizes both the conceptual and the practical aspects of security issues in modern hardware systems. Topics include microarchitectural timing side channels, speculative execution attacks, RowHammer, Trusted Execution Environment, physical attacks, hardware support for software security, and verification of digital systems. Students taking graduate version complete additional assignments.M. YanNo textbook information available",EECS,2024
18.01 Calculus,"18.01 Calculus(,)Prereq: NoneUnits: 5-0-7Credit cannot also be received for18.01A,CC.1801,ES.1801,ES.181ALecture:TR11,F2(2-135)Recitation:MW10(2-135)+finalDifferentiation and integration of functions of one variable, with applications. Informal treatment of limits and continuity. Differentiation: definition, rules, application to graphing, rates, approximations, and extremum problems. Indefinite integration; separable first-order differential equations. Definite integral; fundamental theorem of calculus. Applications of integration to geometry and science. Elementary functions. Techniques of integration. Polar coordinates. L'Hopital's rule. Improper integrals. Infinite series: geometric, p-harmonic, simple comparison tests, power series for some elementary functions.Fall:P. SeidelSpring:T. RudNo required or recommended textbooks",Mathematics,2024
18.01A Calculus,"18.01A Calculus(); first half of termPrereq: Knowledge of differentiation and elementary integrationUnits: 5-0-7Credit cannot also be received for18.01,CC.1801,ES.1801,ES.181ASix-week review of one-variable calculus, emphasizing material not on the high-school AB syllabus: integration techniques and applications, improper integrals, infinite series, applications to other topics, such as probability and statistics, as time permits. Prerequisites: one year of high-school calculus or the equivalent, with a score of 5 on the AB Calculus test (or the AB portion of the BC test, or an equivalent score on a standard international exam), or equivalent college transfer credit, or a passing grade on the first half of the 18.01 advanced standing exam.D. Jerison",Mathematics,2024
18.02 Calculus,"18.02 Calculus(,)Prereq:Calculus I (GIR)Units: 5-0-7Credit cannot also be received for18.022,18.02A,CC.1802,ES.1802,ES.182ALecture:TR11,F2(54-100)Recitation:MW10(2-146) orMW11(2-146) orMW12(2-136) orMW1(2-146) orMW2(2-146)+finalCalculus of several variables. Vector algebra in 3-space, determinants, matrices. Vector-valued functions of one variable, space motion. Scalar functions of several variables: partial differentiation, gradient, optimization techniques. Double integrals and line integrals in the plane; exact differentials and conservative fields; Green's theorem and applications, triple integrals, line and surface integrals in space, Divergence theorem, Stokes' theorem; applications.Fall:D. MaulikSpring:M. KingTextbooks (Spring 2025)",Mathematics,2024
18.02A Calculus,"18.02A Calculus(,,); second half of termPrereq:Calculus I (GIR)Units: 5-0-7Credit cannot also be received for18.02,18.022,CC.1802,ES.1802,ES.182AAttend any 18.02 recitation.Lecture:TR11,F2 (BEGINS MAR 31)(54-100)Recitation:TBA+finalFirst half is taught during the last six weeks of the Fall term; covers material in the first half of 18.02 (through double integrals). Second half of 18.02A can be taken either during IAP (daily lectures) or during the second half of the Spring term; it covers the remaining material in 18.02.Fall:J. BushIAP:J. BushSpring:M. KingTextbooks (IAP 2025);Textbooks (Spring 2025)",Mathematics,2024
18.022 Calculus,"18.022 Calculus()Prereq:Calculus I (GIR)Units: 5-0-7Credit cannot also be received for18.02,18.02A,CC.1802,ES.1802,ES.182ACalculus of several variables. Topics as in 18.02 but with more focus on mathematical concepts. Vector algebra, dot product, matrices, determinant. Functions of several variables, continuity, differentiability, derivative. Parametrized curves, arc length, curvature, torsion. Vector fields, gradient, curl, divergence. Multiple integrals, change of variables, line integrals, surface integrals. Stokes' theorem in one, two, and three dimensions.J. Zung",Mathematics,2024
18.03 Differential Equations,"18.03 Differential Equations(,)Prereq: None.Coreq:Calculus II (GIR)Units: 5-0-7Credit cannot also be received forCC.1803,ES.1803Lecture:MWF1(10-250)Recitation:TR9(2-132) orTR10(2-147,26-328) orTR11(2-139,2-131,26-328) orTR12(2-139,2-135,2-131) orTR1(4-163,1-375) orTR2(1-375,2-131) orTR3(2-139)+finalStudy of differential equations, including modeling physical systems. Solution of first-order ODEs by analytical, graphical, and numerical methods. Linear ODEs with constant coefficients. Complex numbers and exponentials. Inhomogeneous equations: polynomial, sinusoidal, and exponential inputs. Oscillations, damping, resonance. Fourier series. Matrices, eigenvalues, eigenvectors, diagonalization. First order linear systems: normal modes, matrix exponentials, variation of parameters. Heat equation, wave equation. Nonlinear autonomous systems: critical point analysis, phase plane diagrams.Fall:H. CohnSpring:B. PoonenNo textbook information available",Mathematics,2024
18.031 System Functions and the Laplace Transform,"18.031 System Functions and the Laplace Transform()Prereq: None.Coreq:18.03Units: 1-0-2 [P/D/F]Studies basic continuous control theory as well as representation of functions in the complex frequency domain. Covers generalized functions, unit impulse response, and convolution; and Laplace transform, system (or transfer) function, and the pole diagram. Includes examples from mechanical and electrical engineering.S. NadimpalliNo required or recommended textbooks",Mathematics,2024
18.032 Differential Equations,18.032 Differential Equations()Prereq: None.Coreq:Calculus II (GIR)Units: 5-0-7Lecture:MWF1(2-142)Recitation:TR11(2-142)+finalCovers much of the same material as 18.03 with more emphasis on theory. The point of view is rigorous and results are proven. Local existence and uniqueness of solutions.A. LawrieNo textbook information available,Mathematics,2024
18.04 Complex Variables with Applications,"18.04 Complex Variables with Applications()Prereq:Calculus II (GIR)and (18.03or18.032)Units: 4-0-8Credit cannot also be received for18.075,18.0751Complex algebra and functions; analyticity; contour integration, Cauchy's theorem; singularities, Taylor and Laurent series; residues, evaluation of integrals; multivalued functions, potential theory in two dimensions; Fourier analysis, Laplace transforms, and partial differential equations.J. Dunkel",Mathematics,2024
18.05 Introduction to Probability and Statistics,"18.05 Introduction to Probability and Statistics()Prereq:Calculus II (GIR)Units: 4-0-8Lecture:TR2.30-4,F4(32-082) orTR1-2.30,F2(32-082)+finalA unified introduction to probability, Bayesian inference, and frequentist statistics. Topics include: combinatorics, random variables, (joint) distributions, covariance, central limit theorem; Bayesian updating, odds, posterior prediction; significance tests, confidence intervals, bootstrapping, regression. Students also develop computational skills and statistical thinking by using R to simulate, analyze, and visualize data; and by exploring privacy, fairness, and causality in contemporary media and research. Flipped subject taught in a Technology Enabled Active Learning (TEAL) classroom to facilitate discussion, group problem solving, and coding studios with ample mentorship.J. BloomNo textbook information available",Mathematics,2024
